{
  "$schema": "./web.schema.json",
  "version": 2,
  "generadoEn": "2026-10-18T10:00:00Z",
  "portada": {
    "linea": "Horno de barrio · Fuenlabrada · desde 1987"
  },
  "aviso": null,
  "catalogo": [
    {
      "id": "panes",
      "nombre": "Panes",
      "productos": [
        {
          "id": "pan-de-masa-madre",
          "nombre": "Pan de masa madre",
          "descripcion": "Corteza crujiente y miga abierta. 48 horas de fermentación lenta.",
          "descripcionLarga": "Nuestra pieza de siempre. Corteza crujiente, miga abierta y brillante, y ese punto ácido suave que solo dan 48 horas de fermentación lenta. Aguanta tierno tres o cuatro días.",
          "precio": 4.2,
          "unidad": "unidad",
          "etiqueta": null,
          "ingredientes": "Harina de **trigo**, agua, masa madre (**centeno**), sal.",
          "alergenos": [
            "Gluten"
          ],
          "foto": null,
          "fotoFicha": null
        },
        {
          "id": "hogaza-de-centeno",
          "nombre": "Hogaza de centeno",
          "descripcion": "Densa, aromática y con un punto ácido. Tierna toda la semana.",
          "descripcionLarga": "Densa, aromática y con un punto ácido. Tierna toda la semana.",
          "precio": 5.5,
          "unidad": "unidad",
          "etiqueta": "Novedad",
          "ingredientes": "Harina de **centeno** integral, harina de **trigo**, agua, masa madre, sal, alcaravea.",
          "alergenos": [
            "Gluten"
          ],
          "foto": null,
          "fotoFicha": null
        },
        {
          "id": "barra-rustica",
          "nombre": "Barra rústica",
          "descripcion": "La de cada día: alveolada, ligera y de corteza fina.",
          "descripcionLarga": "La de cada día: alveolada, ligera y de corteza fina.",
          "precio": 1.6,
          "unidad": "unidad",
          "etiqueta": null,
          "ingredientes": "Harina de **trigo**, agua, masa madre, sal, levadura.",
          "alergenos": [
            "Gluten"
          ],
          "foto": null,
          "fotoFicha": null
        },
        {
          "id": "pan-de-espelta-y-semillas",
          "nombre": "Pan de espelta y semillas",
          "descripcion": "Espelta integral con pipas de girasol, lino y sésamo.",
          "descripcionLarga": "Espelta integral con pipas de girasol, lino y sésamo.",
          "precio": 4.8,
          "unidad": "unidad",
          "etiqueta": null,
          "ingredientes": "Harina de **espelta** integral, agua, semillas de girasol, lino y **sésamo**, masa madre, sal.",
          "alergenos": [
            "Gluten",
            "Sésamo"
          ],
          "foto": null,
          "fotoFicha": null
        },
        {
          "id": "chapata-de-aceite",
          "nombre": "Chapata de aceite",
          "descripcion": "Masa muy hidratada con aceite de oliva virgen extra.",
          "descripcionLarga": "Masa muy hidratada con aceite de oliva virgen extra.",
          "precio": 2.4,
          "unidad": "unidad",
          "etiqueta": null,
          "ingredientes": "Harina de **trigo**, agua, aceite de oliva virgen extra, masa madre, sal.",
          "alergenos": [
            "Gluten"
          ],
          "foto": null,
          "fotoFicha": null
        },
        {
          "id": "pan-de-molde-de-mantequilla",
          "nombre": "Pan de molde de mantequilla",
          "descripcion": "Tierno, para tostar o para el bocadillo del recreo.",
          "descripcionLarga": "Tierno, para tostar o para el bocadillo del recreo.",
          "precio": 4.5,
          "unidad": "unidad",
          "etiqueta": null,
          "ingredientes": "Harina de **trigo**, **leche**, **mantequilla**, **huevo**, azúcar, sal, levadura.",
          "alergenos": [
            "Gluten",
            "Huevos",
            "Leche"
          ],
          "foto": null,
          "fotoFicha": null
        }
      ]
    },
    {
      "id": "palmeritas",
      "nombre": "Palmeritas",
      "productos": [
        {
          "id": "palmerita-clasica",
          "nombre": "Palmerita clásica",
          "descripcion": "Hojaldre de mantequilla caramelizado.",
          "descripcionLarga": "Hojaldre de mantequilla caramelizado.",
          "precio": 5.75,
          "unidad": "¼ kg",
          "etiqueta": null,
          "ingredientes": "Hojaldre de **trigo** y **mantequilla**, azúcar, sal.",
          "alergenos": [
            "Gluten",
            "Leche"
          ],
          "foto": null,
          "fotoFicha": null
        },
        {
          "id": "palmerita-de-chocolate",
          "nombre": "Palmerita de chocolate",
          "descripcion": "Bañada entera en chocolate negro.",
          "descripcionLarga": "Bañada entera en chocolate negro.",
          "precio": 5.75,
          "unidad": "¼ kg",
          "etiqueta": null,
          "ingredientes": "Hojaldre de **trigo** y **mantequilla**, chocolate (cacao, azúcar, lecitina de **soja**).",
          "alergenos": [
            "Gluten",
            "Soja",
            "Leche"
          ],
          "foto": null,
          "fotoFicha": null
        },
        {
          "id": "chocolate-negro-con-hilos",
          "nombre": "Chocolate negro con hilos",
          "descripcion": "Chocolate negro brillante con hilos de chocolate con leche.",
          "descripcionLarga": "Chocolate negro brillante con hilos de chocolate con leche.",
          "precio": 5.75,
          "unidad": "¼ kg",
          "etiqueta": null,
          "ingredientes": "Hojaldre de **trigo** y **mantequilla**, chocolate (cacao, azúcar, lecitina de **soja**), **leche**.",
          "alergenos": [
            "Gluten",
            "Soja",
            "Leche"
          ],
          "foto": null,
          "fotoFicha": null
        },
        {
          "id": "chocolate-negro-y-blanco",
          "nombre": "Chocolate negro y blanco",
          "descripcion": "Chocolate negro con dos hilos de chocolate blanco.",
          "descripcionLarga": "Chocolate negro con dos hilos de chocolate blanco.",
          "precio": 5.75,
          "unidad": "¼ kg",
          "etiqueta": null,
          "ingredientes": "Hojaldre de **trigo** y **mantequilla**, chocolate (cacao, azúcar, lecitina de **soja**), chocolate blanco.",
          "alergenos": [
            "Gluten",
            "Soja",
            "Leche"
          ],
          "foto": null,
          "fotoFicha": null
        },
        {
          "id": "chocolate-con-leche",
          "nombre": "Chocolate con leche",
          "descripcion": "Chocolate con leche con hilos de chocolate negro.",
          "descripcionLarga": "Chocolate con leche con hilos de chocolate negro.",
          "precio": 5.75,
          "unidad": "¼ kg",
          "etiqueta": null,
          "ingredientes": "Hojaldre de **trigo** y **mantequilla**, chocolate con **leche** (cacao, azúcar, lecitina de **soja**).",
          "alergenos": [
            "Gluten",
            "Soja",
            "Leche"
          ],
          "foto": null,
          "fotoFicha": null
        },
        {
          "id": "chocolate-con-pepitas",
          "nombre": "Chocolate con pepitas",
          "descripcion": "Chocolate con pepitas de chocolate por encima.",
          "descripcionLarga": "Chocolate con pepitas de chocolate por encima.",
          "precio": 5.75,
          "unidad": "¼ kg",
          "etiqueta": null,
          "ingredientes": "Hojaldre de **trigo** y **mantequilla**, chocolate (cacao, azúcar, lecitina de **soja**).",
          "alergenos": [
            "Gluten",
            "Soja",
            "Leche"
          ],
          "foto": null,
          "fotoFicha": null
        },
        {
          "id": "chocolate-blanco",
          "nombre": "Chocolate blanco",
          "descripcion": "Chocolate blanco con hilos de chocolate negro.",
          "descripcionLarga": "Chocolate blanco con hilos de chocolate negro.",
          "precio": 5.75,
          "unidad": "¼ kg",
          "etiqueta": null,
          "ingredientes": "Hojaldre de **trigo** y **mantequilla**, chocolate blanco, chocolate (cacao, azúcar, lecitina de **soja**).",
          "alergenos": [
            "Gluten",
            "Soja",
            "Leche"
          ],
          "foto": null,
          "fotoFicha": null
        },
        {
          "id": "chocolate-crujiente",
          "nombre": "Chocolate crujiente",
          "descripcion": "Relleno crujiente de chocolate bajo una rejilla de chocolate negro.",
          "descripcionLarga": "Relleno crujiente de chocolate bajo una rejilla de chocolate negro.",
          "precio": 5.75,
          "unidad": "¼ kg",
          "etiqueta": null,
          "ingredientes": "Hojaldre de **trigo** y **mantequilla**, chocolate (cacao, azúcar, lecitina de **soja**), barquillo.",
          "alergenos": [
            "Gluten",
            "Soja",
            "Leche"
          ],
          "foto": null,
          "fotoFicha": null
        },
        {
          "id": "chocolate-y-barquillo",
          "nombre": "Chocolate y barquillo",
          "descripcion": "Rebozada en chocolate con trocitos de barquillo.",
          "descripcionLarga": "Rebozada en chocolate con trocitos de barquillo.",
          "precio": 5.75,
          "unidad": "¼ kg",
          "etiqueta": null,
          "ingredientes": "Hojaldre de **trigo** y **mantequilla**, chocolate (cacao, azúcar, lecitina de **soja**), barquillo de **trigo**.",
          "alergenos": [
            "Gluten",
            "Soja",
            "Leche"
          ],
          "foto": null,
          "fotoFicha": null
        },
        {
          "id": "chocolate-blanco-y-cereal",
          "nombre": "Chocolate blanco y cereal",
          "descripcion": "Chocolate blanco con arroz inflado de cacao.",
          "descripcionLarga": "Chocolate blanco con arroz inflado de cacao.",
          "precio": 5.75,
          "unidad": "¼ kg",
          "etiqueta": null,